{"schema_id":"OPM-REVISION-COMPATIBILITY-REPORT-001","schema_version":"0.1","manifest":{"manifest_id":"compatibility.revision.0.1-to-0.2","manifest_version":"0.1.0","sha256":"5d6d7cba0103895421abd143417daf39dccd9d73edb01abde2505eadccf31b61"},"runner_version":"0.1.0","schema_refs":[{"schema_id":"MS-REV-001","schema_version":"0.1","sha256":"437e63bfae925f44e2a0bbed3b52c7f45957ff91fb6d71e989c72f95ad3396c8"},{"schema_id":"MS-REV-001","schema_version":"0.2","sha256":"36cede0a2d7fbcf67e80415d3a7e9713e25cb6734032feb72cbf88d0f95f4fdc"}],"historical_binding":{"profile":{"id":"profile.iso19450.2024.draft","version":"0.1.0","sha256":"4cc3289722ab5c62e9273127318d5dcb383f7f0bdb801d23293afdef48fcbb00"},"rule_set":{"id":"rules.iso19450.2024.draft","version":"0.1.0","sha256":"4293cb22cf2e2e92fe212ed3c31119992509c8a675daa554c64a2ccf10457d64"},"text_grammar":{"id":"grammar.opl.iso19450.2024.draft","version":"0.1.0","sha256":"be315186135f2cfa525128532220b289e083fa4bc70bacb33a4287331467a9d1"},"symbol_catalog":{"id":"symbols.iso19450.2024.draft","version":"0.1.0","sha256":"511dbaec2adb6f49ed6a4d28844e69d1310eb7a67f213e4a30b0ddfc21ef6098"},"normalization_adapter":{"id":"normalization.iso19450.2024.draft","version":"0.1.0","sha256":"6401336ad4b63127047ccd5d50cc418554f0c8490547a6024939b4da5774194c"},"binding_digest":"35bf8490cdd363bc29380cc560d2667a70b72e474b739925b2cda4a598e3c037"},"active_binding":{"profile":{"id":"profile.iso19450.2024.draft","version":"0.2.0","sha256":"5287d3ceb77c4c664b88c6e34a3a5d1c34f85c36037ab2f587705f9d607f899c"},"rule_set":{"id":"rules.iso19450.2024.draft","version":"0.1.0","sha256":"4293cb22cf2e2e92fe212ed3c31119992509c8a675daa554c64a2ccf10457d64"},"text_grammar":{"id":"grammar.opl.iso19450.2024.draft","version":"0.2.0","sha256":"c88e672bd9db7f0405a7ef3fc464043f15cae844931192e3412c94ce05339e7d"},"symbol_catalog":{"id":"symbols.iso19450.2024.draft","version":"0.1.0","sha256":"511dbaec2adb6f49ed6a4d28844e69d1310eb7a67f213e4a30b0ddfc21ef6098"},"normalization_adapter":{"id":"normalization.iso19450.2024.draft","version":"0.1.0","sha256":"6401336ad4b63127047ccd5d50cc418554f0c8490547a6024939b4da5774194c"},"binding_digest":"93805d6e2fdb3ea73c4ddfc0a995d662fbf13dee2d8a6f24fc20c79ecff65d1d"},"case_count":13,"pass_count":6,"blocked_count":7,"failed_count":0,"cases":[{"case_id":"COMPAT-001.V01_SEMANTIC_ONLY_READ.PASS","expectation":"PASS","observed_status":"PASS_MATCHED","attempts":[{"attempt":1,"observed_status":"PASS_MATCHED","input_sha256":"0b4454ac1f59cade5a5fa17c6228834bf237863ebdafce711fdcd40814ee5257","output_sha256":"0b4454ac1f59cade5a5fa17c6228834bf237863ebdafce711fdcd40814ee5257","availability":"NOT_RECORDED","error_code":null,"detail_code":null,"transaction":{"revision_delta":0,"revision_parent_delta":0,"text_artifact_delta":0,"text_trace_delta":0,"finding_delta":0,"operation_delta":0,"receipt_delta":0,"draft_head_changed":false},"head_before":null,"head_after":null},{"attempt":2,"observed_status":"PASS_MATCHED","input_sha256":"0b4454ac1f59cade5a5fa17c6228834bf237863ebdafce711fdcd40814ee5257","output_sha256":"0b4454ac1f59cade5a5fa17c6228834bf237863ebdafce711fdcd40814ee5257","availability":"NOT_RECORDED","error_code":null,"detail_code":null,"transaction":{"revision_delta":0,"revision_parent_delta":0,"text_artifact_delta":0,"text_trace_delta":0,"finding_delta":0,"operation_delta":0,"receipt_delta":0,"draft_head_changed":false},"head_before":null,"head_after":null}]},{"case_id":"COMPAT-002.V01_STORED_TEXT_READ.PASS","expectation":"PASS","observed_status":"PASS_MATCHED","attempts":[{"attempt":1,"observed_status":"PASS_MATCHED","input_sha256":"dea06fe034c98945bf61fbd79e0173a8ff1ffdb71ebaecc7530b9939fb844592","output_sha256":"dea06fe034c98945bf61fbd79e0173a8ff1ffdb71ebaecc7530b9939fb844592","availability":"STORED_TEXT_ONLY","error_code":null,"detail_code":null,"transaction":{"revision_delta":0,"revision_parent_delta":0,"text_artifact_delta":0,"text_trace_delta":0,"finding_delta":0,"operation_delta":0,"receipt_delta":0,"draft_head_changed":false},"head_before":null,"head_after":null},{"attempt":2,"observed_status":"PASS_MATCHED","input_sha256":"dea06fe034c98945bf61fbd79e0173a8ff1ffdb71ebaecc7530b9939fb844592","output_sha256":"dea06fe034c98945bf61fbd79e0173a8ff1ffdb71ebaecc7530b9939fb844592","availability":"STORED_TEXT_ONLY","error_code":null,"detail_code":null,"transaction":{"revision_delta":0,"revision_parent_delta":0,"text_artifact_delta":0,"text_trace_delta":0,"finding_delta":0,"operation_delta":0,"receipt_delta":0,"draft_head_changed":false},"head_before":null,"head_after":null}]},{"case_id":"COMPAT-003.V01_EXACT_DIGEST_REPLAY.PASS","expectation":"PASS","observed_status":"PASS_MATCHED","attempts":[{"attempt":1,"observed_status":"PASS_MATCHED","input_sha256":"0b4454ac1f59cade5a5fa17c6228834bf237863ebdafce711fdcd40814ee5257","output_sha256":"fd88cb2686b07b2fa5a23aff68026ac1d8a11ce6f17b6a210cbf76dc1580792a","availability":"LEGACY_REPLAYED_TEXT","error_code":null,"detail_code":null,"transaction":{"revision_delta":0,"revision_parent_delta":0,"text_artifact_delta":0,"text_trace_delta":0,"finding_delta":0,"operation_delta":0,"receipt_delta":0,"draft_head_changed":false},"head_before":null,"head_after":null},{"attempt":2,"observed_status":"PASS_MATCHED","input_sha256":"0b4454ac1f59cade5a5fa17c6228834bf237863ebdafce711fdcd40814ee5257","output_sha256":"fd88cb2686b07b2fa5a23aff68026ac1d8a11ce6f17b6a210cbf76dc1580792a","availability":"LEGACY_REPLAYED_TEXT","error_code":null,"detail_code":null,"transaction":{"revision_delta":0,"revision_parent_delta":0,"text_artifact_delta":0,"text_trace_delta":0,"finding_delta":0,"operation_delta":0,"receipt_delta":0,"draft_head_changed":false},"head_before":null,"head_after":null}]},{"case_id":"COMPAT-004.V01_SQLITE_REOPEN.PASS","expectation":"PASS","observed_status":"PASS_MATCHED","attempts":[{"attempt":1,"observed_status":"PASS_MATCHED","input_sha256":"0b4454ac1f59cade5a5fa17c6228834bf237863ebdafce711fdcd40814ee5257","output_sha256":"0b4454ac1f59cade5a5fa17c6228834bf237863ebdafce711fdcd40814ee5257","availability":"NOT_RECORDED","error_code":null,"detail_code":null,"transaction":{"revision_delta":0,"revision_parent_delta":0,"text_artifact_delta":0,"text_trace_delta":0,"finding_delta":0,"operation_delta":0,"receipt_delta":0,"draft_head_changed":false},"head_before":null,"head_after":null},{"attempt":2,"observed_status":"PASS_MATCHED","input_sha256":"0b4454ac1f59cade5a5fa17c6228834bf237863ebdafce711fdcd40814ee5257","output_sha256":"0b4454ac1f59cade5a5fa17c6228834bf237863ebdafce711fdcd40814ee5257","availability":"NOT_RECORDED","error_code":null,"detail_code":null,"transaction":{"revision_delta":0,"revision_parent_delta":0,"text_artifact_delta":0,"text_trace_delta":0,"finding_delta":0,"operation_delta":0,"receipt_delta":0,"draft_head_changed":false},"head_before":null,"head_after":null}]},{"case_id":"COMPAT-005.V01_TO_V02_SAME_BINDING.PASS","expectation":"PASS","observed_status":"PASS_MATCHED","attempts":[{"attempt":1,"observed_status":"PASS_MATCHED","input_sha256":"003c4549e5dbe71d483f46fdc73b5e27b984c4fc0ca9dbc7364e0b9bcc0a8fe5","output_sha256":"32af0236b8a87350325fef356e5eaaab0e40a47a60baa5f9460124cca3f5b02d","availability":"FULL","error_code":null,"detail_code":null,"transaction":{"revision_delta":1,"revision_parent_delta":1,"text_artifact_delta":1,"text_trace_delta":2,"finding_delta":0,"operation_delta":1,"receipt_delta":1,"draft_head_changed":true},"head_before":"revision.base.golden.struct.003","head_after":"revision.compatibility.005.0002"},{"attempt":2,"observed_status":"PASS_MATCHED","input_sha256":"003c4549e5dbe71d483f46fdc73b5e27b984c4fc0ca9dbc7364e0b9bcc0a8fe5","output_sha256":"32af0236b8a87350325fef356e5eaaab0e40a47a60baa5f9460124cca3f5b02d","availability":"FULL","error_code":null,"detail_code":null,"transaction":{"revision_delta":1,"revision_parent_delta":1,"text_artifact_delta":1,"text_trace_delta":2,"finding_delta":0,"operation_delta":1,"receipt_delta":1,"draft_head_changed":true},"head_before":"revision.base.golden.struct.003","head_after":"revision.compatibility.005.0002"}]},{"case_id":"COMPAT-006.V02_ROUNDTRIP_REPLAY.PASS","expectation":"PASS","observed_status":"PASS_MATCHED","attempts":[{"attempt":1,"observed_status":"PASS_MATCHED","input_sha256":"720ee4c14d988c89d7887b8e952926de9d732d2677b882d68834ca5b8195d20c","output_sha256":"bbae0a06462c5452d4c74da12d00703bf830ca39036750775ccc9a697a0321d1","availability":"FULL","error_code":null,"detail_code":null,"transaction":{"revision_delta":1,"revision_parent_delta":1,"text_artifact_delta":1,"text_trace_delta":2,"finding_delta":0,"operation_delta":1,"receipt_delta":1,"draft_head_changed":true},"head_before":"revision.base.golden.struct.003","head_after":"revision.compatibility.006.0002"},{"attempt":2,"observed_status":"PASS_MATCHED","input_sha256":"720ee4c14d988c89d7887b8e952926de9d732d2677b882d68834ca5b8195d20c","output_sha256":"bbae0a06462c5452d4c74da12d00703bf830ca39036750775ccc9a697a0321d1","availability":"FULL","error_code":null,"detail_code":null,"transaction":{"revision_delta":1,"revision_parent_delta":1,"text_artifact_delta":1,"text_trace_delta":2,"finding_delta":0,"operation_delta":1,"receipt_delta":1,"draft_head_changed":true},"head_before":"revision.base.golden.struct.003","head_after":"revision.compatibility.006.0002"}]},{"case_id":"COMPAT-007.UNKNOWN_SCHEMA.BLOCKED","expectation":"BLOCKED","observed_status":"BLOCKED_MATCHED","attempts":[{"attempt":1,"observed_status":"BLOCKED_MATCHED","input_sha256":"a9185bb5b1cfec3b12e212cad0b4587c1dd78f1b27d190e12394dd4cd934d3e6","output_sha256":null,"availability":null,"error_code":"FORMAT_VERSION_UNSUPPORTED","detail_code":"REVISION_SCHEMA_UNSUPPORTED","transaction":{"revision_delta":0,"revision_parent_delta":0,"text_artifact_delta":0,"text_trace_delta":0,"finding_delta":0,"operation_delta":0,"receipt_delta":0,"draft_head_changed":false},"head_before":null,"head_after":null},{"attempt":2,"observed_status":"BLOCKED_MATCHED","input_sha256":"a9185bb5b1cfec3b12e212cad0b4587c1dd78f